{"authorization_id":"syn-auth","intent_id":"syn-i","intent_hash":"sha256:687bc9894622b0eea1d025fd8c1bb17af051184eca718a2863ec0ed5ac3b06e6","policy_version":"test-v1","approval_id":"syn-approval","executor_id":"synthetic-executor-not-invoked","authorized_at":"2026-09-03T02:10:00Z","expires_at":"2026-09-03T02:45:00Z","idempotency_key":"syn-k","correlation_id":"syn-c","execution_mode":"APPROVED_LIVE","execution_authorized":true}
